,Unnamed: 0,comment_id,product_id,guid,content,create_time,reference_id,reference_time,score,nickname
234,4,11395836369,6946605,f1a807b9-192a-440b-8efd-f2aec1b47de4,"因为是买给老妈用的，担心5.8寸的屏幕太大，拿到手一看感觉大小正合适，和原来旧手机华为G9基本一样大，当然屏幕就大不一样了。
上手就用了手机推荐的手机克隆软件，将G9上所有的软件，记录，图片，视频全部复制到P20，只需要简单几个步骤，半个多小时就搞定了，基本和旧手机的数据完全一致，非常方便。
选P20一是看重它配置比OV高的多，二是有前置的指纹键很方便，不用象G9那样用虚拟键。我自己用mate9 Pro感觉很方便，所以推荐给老妈。
今晚用来拍了几张照片，确实名不虚传，反应迅速，对焦精确，图像清晰锐利，非常满意。
感觉不习惯的地方就是镜头突出还是有点不美观，另外就是双面玻璃，非常光滑，拿在手里很紧张。
总体很满意这次抢购，家里很多HW的手机，荣耀6，荣耀8，G9，mate9 Pro，P20，希望国产手机越来越好！",2018-04-14 00:28:50,6946635,2018-03-28 14:19:06,5,催***Y
235,5,13112596462,6946605,a646cee0-b4c4-4939-aabf-52ff31ba60d6,挺好的，家里人的手机都是在京东买的。物美价廉，物流很快，特别方便。推荐。使用一段时间了，没啥问题。,2019-08-13 10:41:10,7321794,2019-07-26 11:01:12,5,d***s
236,6,11405091915,6946605,3b0b6309-1511-4fab-948f-750f526afd74,手机特别好看，用着手感也很好，特别流畅，很喜欢，充电很快，20分钟能充百分之30多的电，基本早上醒来充半个来小时，待机一天没问题，但是充满电需要1个半小时多到两个小时，时间还是比较长的，但是电量很耐用，总体来说很满意。,2018-04-17 12:05:38,6946637,2018-04-12 15:32:32,5,j***s
237,7,11698497642,6946605,ce60361b-9b20-4624-b913-907249321331,"买到了极光色 漂亮惊艳 很有质感
处理器性能中规中矩，不玩游戏应该是足够了
拍照特别令人满意，相张很好。
电池没有想象的那么强大。
指纹解锁和人脸解锁快到起飞。",2018-07-13 01:26:51,7321794,2018-06-23 22:02:45,5,j***2
238,8,11550128752,6946605,4069cfc5-8d03-4dfb-9ea1-f5ceb8d1b556,"p20这款手机
优点
颜值真的赞，拍照很技术，性能完美！
充电很快，系统很流畅～～
就是用久了发烫，屏太小，不过到手操作很ok，
还有价格贵了点。

总之不错啦",2018-06-03 19:34:29,7321794,2018-06-01 00:19:09,5,张***事
239,9,12144355639,6946605,35a3a16d-784b-4a4b-9af6-a979d74b9397,给老婆买的，外形适合女士用，很小巧，拍照会自动适用合适的情景模式，成像效果比我用的nova2s要好一些，充电速度是真快，从百分之35到百分之90也就一个小时吧。目前还算满意，以后有时间追评。,2018-11-16 15:37:01,6946605,2018-11-14 12:00:20,5,j***r
240,0,11817146054,6946605,de4869f0-4453-4f8c-8bc0-7af8c213dc82,因为正在用，所以没拍照片，手机超美。送了原厂膜，保护套，耳机线，京东还送了叮咚！配件齐全，提前买回来的各种壳各种膜，就镜头膜贴上了，商家贴心。我以前用小米可是没有这样的。拍摄超美，颜值超高。玩各种游戏流畅开软件迅速。非常好用。配一张手机拍摄地照片,2018-08-18 08:59:33,7321794,2018-08-11 22:56:57,5,白***翎
241,1,12124715556,6946605,ce346088-baf8-4c25-8560-30846e74a741,第一次用华为手机，感觉还是蛮好的，系统优化真的比三星要好，画质也很清晰，手机用着很流畅，最重要的是电池比三星好太多，唯一感觉不太满意的地方就是吃鸡界面画质模糊，比还没三星S6显示的效果清晰，感觉华为还是要在gpu这方面下功夫，总之比较的满意,2018-11-13 09:18:21,6946637,2018-11-11 00:05:43,5,一***子
242,2,12176051459,6946605,7d7a47b8-f974-4f6a-a648-fb9af8aad042,昨天中午下的单，今天早上就到了，京东物流还是快的，不吹不黑，然后手机嘛，刚打开还是没有想象中的大，但是也还不错了，手感很不错，外形也还OK，尤其是背面可以当镜子用 嘿嘿 性能的话 用去还是很敏感的 相机像素也很高 总之 很不错就对了 nice,2018-11-23 10:22:58,7321794,2018-11-22 12:54:51,5,呃***N
243,3,12033554352,6946605,c44a9999-85bf-4bb4-bc1d-66b10a9d41a6,"P20和Mate20之间，我还是选择了P20。颜值是真的高?
运行速度是真的快啊，各种大小的APP应用秒开。 
手感也特别好，单手操作非常舒服，长宽高尺寸是比肩水果X的，有一个下巴全是小遗憾了。
拍照方面的不如P20Pro，Mate20Pro，但是和国产其它机型想必已经是绰绰有余了。
续航嘛，一天一充。",2018-10-22 19:46:55,6946605,2018-10-19 23:36:39,5,K***6
244,4,12441419179,6946605,64bf6256-72c4-487b-98f5-38ece49d3aea,外观很喜欢，电池也耐用，充电的时候速度嗖嗖嗖，完全不担心内存不够用，支持国产，好评耶,2019-02-09 12:26:23,7321794,2019-01-04 19:23:44,5,j***z
245,5,12531775006,6946605,edefdbfc-e1d3-4e21-8565-8a4aed648751,还可以，用着还是很流畅的，拍照还可以，屏幕很大，颜值也挺高的.第一次用华为的手机，竟然还带了耳机和手机壳和膜，太惊喜了，满意！,2019-03-11 12:36:00,7321794,2019-03-01 20:47:33,5,南***空
246,6,11653306181,6946605,0444c5bf-e2c6-4360-b913-7e8826cab802,手机性能很好，老婆，和老妈用的都是同一款手机，操作方便，外观也很漂亮，嗯，因为这款手机的屏幕绞窄比较长，单手操作比较舒适，所以比较适合女性使用，这是我个人认为。就是吃鸡的时候有点卡，为这事我媳妇埋怨过很多次。个人还是比较满意的。,2018-06-29 10:34:01,6946633,2018-06-27 15:28:38,5,往***昔
247,7,12902617522,6946605,85bce07b-2a90-4cbd-878d-b7744dad1598,用了一段时间了，外观漂亮，运行流畅，另外拍照效果也很好，再也不用某果了，哈哈！,2019-06-17 20:50:01,7321794,2019-06-01 23:41:22,5,陌路转角
248,8,12573535376,6946605,cf75ea0e-f93d-43f9-aa12-e56bc273286f,用了一段时间了，很稀饭，内存足，反应快，手机颜值在线，我的手拿起来刚刚好，物流也很给力。,2019-03-23 23:56:09,7321794,2019-02-25 14:12:22,5,l***9
249,9,12405273183,6946605,a62d46fc-495a-46dd-817d-985976dbee15,很喜欢，通过验证是正品，赠送的手机壳、保护膜很贴心。人脸识别、指纹解锁很快，比苹果好用多了，华为代表的是中国的尖端科技，支持华为就是爱国。,2019-01-24 09:49:07,6946605,2019-01-22 04:54:44,5,j***e
250,0,12374212156,6946605,564723de-19d2-465e-aa95-bcec2f9379ec,快，好快，非常快！次日达，手机克隆链接热点也很快就导好了数据。图片通讯录全过来了，国货越来越强，支持华为，支持国产！,2019-01-15 11:09:02,7321794,2019-01-14 13:58:16,5,j***l
251,1,12441410354,6946605,e046f7a9-1dda-4e19-99f1-9c959f485185,这款手机用起来非常不错，室友推荐我买的，这是我自己配的手机壳，本命年红色，搭配起来很有范。配送非常给力，当天买的当天到了。,2019-02-09 12:19:45,7321794,2019-01-21 10:12:04,5,j***u
252,2,12186312112,6946605,a46b7dd9-c26b-4403-9834-4daf6ccf4b4b,这个手机用起来特别顺手，顺畅，拍照方面是一大亮点，莱卡双摄超级棒，滤镜也很牛#，自动识别场景切换模式。用了一段时间，除了电池续航不是很久外，其他真心不错，同价位的手机确实是一个不错的选择。不过现在的智能手机电池都是短板，期待华为研发的石墨烯电池快点派上用场！！,2018-11-25 21:09:31,7321794,2018-11-11 23:55:24,5,阿***远
253,3,12563939358,6946605,3875283f-6831-4488-b246-9ba0e422f329,一拿到就迫不及待地用了，拍照效果秒杀苹果，特别是夜间拍照。用了半个月，没有出现卡机的情况，以前一直用苹果，现在觉得华为已经超越苹果了，特别是nfc功能，手机刷卡很方便，性价比比苹果高。,2019-03-21 08:47:15,6946637,2019-03-01 23:14:05,5,n***l
254,4,12161943692,6946605,c7f5dcc2-e090-4992-b9c6-22e7aeda032d,终于拿到了手机，一开始不想选极光色的，但喜欢的黑色木有，拿到之后觉得这个颜色较深，还算hold得住，而且渐变色也多了点神秘感，越看越喜欢。手机又轻又薄，屏幕是真心的大，看着特别舒服；功能也特别多，还在研究中；随机还赠送了透明手机壳，屏幕膜也已经贴好了，这个服务真心赞！,2018-11-20 00:18:43,6946641,2018-10-19 20:35:29,5,j***0
255,5,12306439802,6946605,f70862b9-5d2d-4b33-85f9-1ad669a20a89,手机外观很不错  适合年轻人 运行起来也很流畅 相机要表扬一下 拍照有提升 屏幕看来很不错? 华为手机现在越做越好了  安排～,2018-12-26 20:09:58,7321794,2018-11-11 11:08:01,5,j***r
256,6,11461029834,6946605,e98062b7-d6f0-4368-92d4-adfb235c653b,充电挺快的，15分钟就能充40％的电，快递也很快，用着挺方便的，手机发热情况不是很明显，平常不用，待机电量也很好，软件用着也很快，更新后台进行，不用管，第一次使用华为手机，挺好的，没有失望，价格要是更亲民就更好了，周围朋友对华为品牌认可度不错，包装有点简单，好担心运输中有磕碰，这款手机综合性能还是可以的！,2018-05-06 22:25:06,6946631,2018-05-05 13:03:25,5,j***4
257,7,12330015960,6946605,464e6a2f-6f7f-420f-9bdd-bb9e321db13a,真机绝对比图片好看。充电，续航，颜值，流畅度，都值得点赞。尤其还有一颗中国芯。流畅度对比ios也没让人失望。,2019-01-02 18:23:25,6946641,2019-01-01 20:02:34,5,迷***鹰
258,8,12406458470,6946605,bab66ee3-4e4e-4d6f-a1df-c54e39f74976,性价比超高，颜值超高，性能不错，好多实用的设置，玩吃鸡偶尔有卡顿，给我家老爷子买的，他又能在老李老孙面前显摆了，前提是小李小孙今年没有暴富&hellip;&hellip;??,2019-01-24 15:23:55,6946637,2019-01-22 19:48:06,5,l***7
259,9,12439252786,6946605,28b4de8c-6a4f-4d61-93bc-a99219b47078,第一次用华为手机，相信质量是不错的，出厂送了硅胶保套，看说明还贴了屏幕钢化保护膜，很贴心，总体来说感觉不错，用段时间再综合评！,2019-02-07 14:54:55,6946605,2019-02-06 15:17:13,5,lantian86722
260,0,12234277825,6946605,1ea3f1bc-d7e8-4cd8-8643-0c04ed5fcc05,"挺喜欢京东的！这些年在京东上买了非常多东西，其中有笔记本电脑，11年买的，现在还在用。还有手机买了3部，首先13年初买的小米2s用了3年多，到16年初换了华为P9一直用到现在，就是电池不耐用了，才换的P20，嗦了一堆，我只想说京东上面质量还是非常棒的！
昨天上午下的单，今天上午就到了！物流一如继往的给力！p20整体来说是非常好的，尤其是超级充电非常快，不到两小时手机就能充满！很好！",2018-12-08 18:05:42,6946641,2018-12-07 13:42:01,5,天***累
261,1,11925404387,6946605,e11d6ebe-bb7a-45ec-90b8-fb8606a69f70,手机颜色很亮适合年轻人?，另外手机屏幕刚好适合，拿着很舒服，另外振动也很舒服，整个机子振着很脆！很强大的内核，新出的oppor19和vivoX21和这个都对比过，但他们的内核太低，最终还是选择这个，还看中华为p20的天际通！很强大，唯一的遗憾是这款没红外，整体还是很不错！,2018-09-19 10:40:23,8758880,2018-09-10 15:58:03,5,z***5
262,2,12291204645,6946605,0872986b-8aac-4984-86d4-1dc5722f82d6,自己大学生，一直拿爸妈生活费，出来**挣点钱也不知道怎么花，可能是没女票吧，双十二就挑了这个华为送给我亲爱的老妈，她拿到手一星期都不舍得用，她说旧手机还可以用，旧的是个办宽带捆绑销售的某牌手机，用两年体验肯定很不舒服的。自己也好喜欢这个手机，拍照很好，所以适合爱拍东西的我妈咪，游戏还有其他功能就不需要了，用两年应该妥妥**。,2018-12-22 17:04:30,8758870,2018-12-12 00:06:13,5,j***z
263,3,12056098318,6946605,828042ea-b844-427c-86ee-6cad3b9bdc1e,很漂亮的手机 屏幕比p9大这么多整体尺寸却差不多，而且极光色实在是太漂亮了，手机克隆也很方便，续航新机肯定是很强的，性能也比p9好很多，指纹在正面方便不少，总体是很不错的一台手机,2018-10-29 11:06:59,6946641,2018-10-27 20:52:42,5,x***e
264,4,11824227262,6946605,0d339710-6714-4a12-977c-2af240a1d19a,性能很好，比预想还要好，电量充足，工作日正常使用可以两日一充，当然是新电池的性能，上手有点厚重，但很快适应，买的是蓝色，非常好看,2018-08-20 11:51:52,6733008,2018-08-17 15:56:45,5,j***e
265,5,11868080852,6946605,06044b08-d3b2-4b97-8221-39dca5bf33cd,"1.粉色很漂亮，是渐变的，超级好看
2.使用了一个多礼拜，速度快，一点都不卡
3.吃鸡也完全没问题
4.拍照真的很牛逼
5.握在手里很舒服
6.玩久了会发热，只是温热，但是有一回吃鸡手机有点烫",2018-09-02 16:17:32,6946635,2018-08-24 13:50:03,5,j***a
266,6,11851087177,6946605,d4ade415-76c6-4d70-914c-0fe41f610d39,"手机收到了,质量不错,好用。新款式,像素高,音质清晰,触摸灵敏,反应快,很满意。卖家发货快,服务态度好,想换手机的可以考虑一下哦!",2018-08-28 12:40:26,7321794,2018-08-23 22:26:27,5,j***h
267,7,11986903525,6946605,d4dad823-5e66-49fe-adc8-f06c27ea58e5,比想像中的重量稍轻，有点儿影响质感，但是设计做工很好，配色也很漂亮。使用体验很棒，华为越来越人性化了，虽然也在走会员云服务的圈钱套路，至少比水果机方便很多。拍照效果没的说了，功能强大，非常给力。续航也还可以，比mate10稍差一点儿。支持国货，希望华为越做越好。,2018-10-08 22:10:25,6946641,2018-10-06 13:53:22,5,p***0
268,8,12867827694,6946605,38cf4881-3e36-446f-922b-0429a65dd594,|量不e，手感好，速度快，界面Or尚，充电接口很好，送的膜不行，改进。支持国货，华为越碓桨舭舻模,2019-06-10 08:41:23,7321794,2019-06-02 08:15:24,5,HANZHANG0925
269,9,11402858793,6946605,b5ed938a-13c9-4a81-94bf-0c163250b7c2,全面屏外观很惊艳，宝石蓝很深沉，直接买了顶配，运行速度很快，华为的系统用着也很顺手，特别要大赞一下音质和拍照，效果简直太好了，真有点爱不释手了。推荐大家购买。,2018-04-16 15:58:07,6733008,2018-04-14 20:07:40,5,无***泡
270,0,12606346167,6946605,5a00d1ff-6774-4fc1-8cd7-2789b2da6013,这款手机很好用哦 超级好看的 颜值超高的 玩游戏什么的也很顺畅 总体说 值得购买 大家可以入手,2019-04-02 13:58:26,6733008,2019-03-26 17:01:09,5,皮***哦
271,1,12384417664,6946605,17a907c5-5392-4524-b749-bf3d744cfe6c,"买了给老爸用的，很好看，用起来也很流畅
像素没的说，比我的荣耀九强了不止一倍",2019-01-18 10:09:00,6946641,2019-01-11 14:34:47,5,S***森
272,2,11437039679,6946605,da0c7c37-ceca-4c90-aef0-92b415e404b3,可以 很完美 超大电池容量 完美的摄像镜头 怎么拍都是大片 可以没有极光色啊 最好看的极光色！！ 系统用起来流畅多了。商务机专用，玩游戏用芯片还是差了点！附上x和p20的对比 夜景模式超棒！！！,2018-04-28 11:49:42,6946631,2018-04-12 16:48:28,5,k***8
273,3,12185089847,6946605,edb390c3-6669-49ef-82a3-5b7525bc8ba7,好评，相机不错，反应很快，整个操作跟iOS区别不大，很流畅，home键功能很好，集合度不错，待机时间也很不错，单手操作很不错,2018-11-25 16:02:55,6946637,2018-09-30 21:58:54,5,漂***叶
274,4,11773810218,6946605,43523f64-2b3d-4058-a8a7-8f1596d93309,还不错 用了几天都不想用苹果了，屏幕尺寸 分辨率都完胜苹果，功能也更强大，更重要的是拍照功能非常好，随便一拍就是大片，拍文字也更清晰，就看用久了系统会不会卡,2018-08-04 20:07:03,6946635,2018-06-11 19:50:19,5,5***0
275,5,11870909898,6946605,7155143d-e1df-4b95-ac2f-722bf77e9bfb,很酷的一款手机 颜色很漂亮  给孩子买的 很喜欢  手机总玩电能用一天吧 （游戏除外）性能还不错,2018-09-03 13:39:10,7321794,2018-07-08 10:35:24,5,j***a
276,6,11698633689,6946605,e0ecfdd7-c647-457d-9d58-2577fe60230f,被惊艳～到了?，外型我喜欢，拍照功能强大，玻璃后屏摸起来很舒服，新机一点都不卡，各种手游轻飘飘，之前的一款也是华为，年代久远了，没办法要换了，要换就换好的，所以我就选了p20，果然没让我失望，颜值在线，性能在线，品牌在线，体验感贼好，真是一次满意的购物，给个赞。,2018-07-13 07:28:56,6946631,2018-06-01 18:34:51,5,s***s
277,7,11816253591,6946605,946c25f7-e409-4cc2-b77d-16eeb5589dfa,喵了更长一段时间了，一直期待有个降价，到了七夕还没有。16号上午拍，下午就到了，实在很给力！亮黑色，非常的闪，看着非常有质感，屏幕色彩让人赏心悦目，这点很看重。双摄的效果和宣传效果一样。总之喜欢就好，也希望华为，越来越好，做出自己。,2018-08-17 20:26:40,6946605,2018-08-16 10:10:41,5,s***5
278,8,11814133566,6946605,0c7078d3-c86a-418f-a011-3b9da7d2d7be,首先颜值很重要，颜值很高啊，极光色太好看了，超级喜欢啊啊啊，然后手机手感也不错，拍照功能真的比苹果好多了，特别夜景，晚上很暗的地方也拍得超级清晰，就是用久了苹果突然换了就用得还不太习惯，要适应几天，64G我觉得够用了，主要我也不打游戏,2018-08-17 09:19:06,7321794,2018-08-16 08:19:52,5,j***y
279,9,12632663380,6946605,3d348f71-3ae2-482c-83fa-04fce67fd78e,使用了一段时间才来评价，屏幕很清晰，速度也快，拍照效果很好，像素高，充一次电能用很久，手感也不错。,2019-04-10 09:37:25,7321794,2019-03-10 20:20:00,5,A***h
280,0,11683804583,6946605,f6316798-d8e3-44a7-9974-cf896cfc59a2,手机刚刚拿到手，等了两天，感觉等了好久的感觉，大概是很期待，时间过得慢吧！手机相比原来的，真的超级不错啊，很流畅，玩了不怎么发热，原来的很烫，现在的华为P20，真的超级好用哦，感觉拍照效果超级棒，运行超流畅超流畅，太棒了！然后是刘海全面屏设计，现在流行这个嘛，颜值高，极光色超赞的?！！好喜欢好喜欢。感觉能用很久了。挺不错的手机&hellip;支持华为！,2018-07-08 15:20:35,7321794,2018-07-06 11:54:50,5,M***y
281,1,12616923840,6946605,e76f5cac-6af7-424d-8bb6-2d5f783f70fb,支持华为，支持国产，第一次用安卓机，除了有些不习惯，其他的都挺好的，很顺畅很快，屏幕分辨率看着真舒服。手机外观也很帅气。,2019-04-05 16:45:59,6946637,2019-04-04 08:31:54,5,染书的勾勾
282,2,12156783369,6946605,ff053e42-1c7b-4789-b560-288d03d1a33b,内心喜欢一部港版三星s9，但还是买了官网的华为，不过收到很意外的惊喜，屏幕外观真的好漂亮，声音也很好，耳机党的福利啊，真的像别人说的，买了绝对不会后悔，最近几年慢慢开始意识到手机的作用永远是联系吧，渐渐杜绝媒体软件，回归自身的我，有时候仅仅需要基础功能，再来就是好看了，很满意，一开始就是朝着能用五年的手机买的，但愿不负所托！很喜欢啦！小插曲：买手机记得检查地址，搬家了，然后跑了四个小时回去拿的手机，我也是&ge;n&le;很顽强啊！,2018-11-18 23:25:29,7321794,2018-11-16 23:00:48,5,j***u
283,3,12388555575,6946605,310cbfb3-c707-4e68-916f-c5fe653e82ab,手机很漂亮，速度也很快。用了一天后，感觉功能非常强大，也很人性化。原来一直用苹果，这次可是意外的惊喜。支持国货，希望国家的制造业能够加快发展,2019-01-19 13:57:23,8758880,2019-01-17 00:03:32,5,j***1
284,4,12434560236,6946605,89dfbabc-b46b-4ba8-8faa-fc628f4ed9c8,这是公司年会买的奖品，看起来很有质感的，这是定的一等奖，我自己采购的，居然被我自己抽中了，哈哈，给我老公用了，老公挺喜欢的，颜色很好看，渐变色很有特点，各项功能都不错，充电器线好粗，头子很大，不容易坏，总之很满意，京东物流好快，又有发票，今年年会我采购了一大堆奖品，都很满意，不错,2019-02-03 09:06:12,8758880,2019-01-28 16:58:01,5,l***2
285,5,12036097381,6946605,c940d34e-b654-4f82-b51e-28db62efe97a,"新款手机等了很久，京东客服服务周到，谢谢了。
手机很上档次，做工精美，操作系统杠杠的，不比苹果差。拍照更让我眼前一亮一亮一亮的，老婆本来要苹果8的，后面拿到这手机，很是喜欢，为华为点赞，为京东服务点赞",2018-10-23 14:50:24,8969543,2018-09-30 23:06:03,5,j***3
286,6,12283460550,6946605,16790520-543e-4fbc-ba70-311afcb299e6,这款手机是很期待的，现在到了，跟自己想象的都一样，很好，非常喜欢，觉得自己买对了，包装没问题，手机也没问题，快递也很快，喜欢,2018-12-20 14:56:49,7321794,2018-12-19 19:57:39,5,刘***娘
287,7,12156137933,6946605,bc712501-a50e-4a35-81c2-6aa4c9f2e8b1,手机很棒，买华为就是冲着双卡和电池去的，双卡真的必须，还有双开~，电池也可以，看视频半天，听音乐大半天，日常工作应该一天没问题。音乐外放和拍摄效果也不错，总体来说3000价位的手机还是值得的。,2018-11-18 21:09:11,6946635,2018-11-11 00:21:54,5,j***p
288,8,11651844446,6946605,55338558-1fcb-4546-ba52-5ff922a50716,"20好用好用好用，一开始还不太习惯，因为屏幕比较小，以前用的都是p9，所以感觉很别扭，不过用一段时间之后就会发现特别好用，而且，华为的系统一键云端恢复数据，特别方便,支持国产支持华为",2018-06-28 20:03:37,6946631,2018-06-01 00:10:05,5,泉***幽
289,9,12070259127,6946605,adf33e87-a90d-4f45-ab96-566a1d7a9a25,给表妹买的手机，她手机坏了，华为这款手机真的非常漂亮啊，特别是背部，五彩斑斓的，女孩子拿着非常nice，不错，就是正面嘛，啧啧啧，万年刘海屏，不好&hellip;&hellip;&hellip;,2018-11-01 23:38:20,6946641,2018-10-31 15:57:48,5,jd001vip
290,0,12195112410,6946605,eb05c719-79a2-4e4b-8efc-0e3c7fe86506,用了一段时间才来评论，真的是炒鸡喜欢后置摄像头，拍风景炒鸡好看，附送几张拍出来的风景，不过自拍不太满意，感觉自拍有种美颜很油腻的感觉（不开美颜也油腻），就是很不真实，手机颜值很高，小巧玲珑，后盖可以当镜子用，???，物流超快，双十一买，第二天到,2018-11-28 07:14:23,6946641,2018-11-11 00:15:37,5,我***呢
291,1,12375615335,6946605,a0704f18-9a2e-4822-8796-1dc36fc8d7a9,手机很好用，运行速度很快，很喜欢，可以下载很多软件，很不错，屏幕也很好,2019-01-15 17:32:40,7321794,2019-01-01 20:12:38,5,孤***狼
292,2,12665127254,6946605,b2cd4cda-b58e-47f2-a547-0040c95e547c,用了一星期才来评价！总体来说非常不错！流畅清晰度都很好！像素也很高！唯一的美中不足是没有耳机插孔！不过商家很贴心的送了转换接头！很好！,2019-04-18 22:23:27,6946605,2019-04-11 20:51:29,5,就咋啦木了
293,3,11870433240,6946605,4aef6d19-404b-4f8e-8dc2-574384364dff,手机颜色太好看了吧 运行也很流畅 就是之前用苹果 奈何苹果越来越贵 换不起了 转战华为 感觉很不错 颜值反应速度都在线 拍照也很清晰 好用 赞?！！！！,2018-09-03 11:22:58,7321794,2018-08-25 21:36:22,5,眼***辰
294,4,12591225961,6946605,2f9cdc5b-94a0-4106-9dd2-d1239a5f9b01,华为就是不错，外观好看，系统流畅，指纹解锁灵敏，刷脸也很快，各项指标都不错，推荐购买。支持华为，支持京东。,2019-03-29 07:44:59,6946641,2019-03-28 10:41:37,5,缘得伊人醒
295,5,11717366380,6946605,ab0d4c3d-ee07-4676-b1e7-de29b12cb104,窄面宽屏，够薄够轻。上手手感很好。亮黑色真的显得很高级，画质清晰细腻。充电很快，手机普通玩家续航能达到一天半这样。试用了下指纹锁跟AI人脸识别，秒解锁。像素够高，照出来的相片亮度跟色彩都很饱满。发热程度可以接受。标配配的配置下有送手机壳。整体来说性价比很高,2018-07-18 17:03:42,6946637,2018-07-04 19:41:52,5,韦***8
296,6,11734021395,6946605,2acaf22a-52d6-4707-b7ac-da53b58c0c00,"用了一段时间了，手机握在手里的手感非常好，反应速度也超快，嗖嗖的，超赞?。机子里面自带的图片都超漂亮，还送了耳机和耳机转换头，还有手机壳，质量很好的。上一个手机是华为荣耀6plus，用了三年了，华为手机用着不错，支持国产，支持华为。
后来我自己买了一个U盘转接头，本以为就可以用这个连充电宝了，看来我是错了，还是得用原装充电线。",2018-07-23 17:12:01,6946599,2018-07-08 11:06:09,5,j***n
297,7,12620790390,6946605,83db0fdf-db66-4f42-9141-35ddd140f063,手机超级好，电耐用，外观好看反应快，挺不错的，首先快递很快，其次是真的超级?高端大气上档次，看着耐用，值得购买,2019-04-06 20:40:33,7321794,2019-04-05 12:07:31,5,jd_卟解释
