,Unnamed: 0,comment_id,product_id,guid,content,create_time,reference_id,reference_time,score,nickname
0,0,13147526368,6946605,f1b68a58-fa6b-40cb-a1b1-865c5a9ec9ac,送货很快，手机不错很漂亮，极光色高颜值，用起来也很流畅，机身很轻，做工细致，比较喜欢。而且用户体验很好，自带贴膜出场，也带壳的，性能配置麒麟970，电池容量也不小，比较耐用，系统流畅比较稳定。拍照效果很棒，成像很清楚，主打照片，适合爱拍照的人，前置摄像头的像素也够用，效果不错，夜景模式还没有试过，能满足日常照像需要,2019-08-23 15:58:40,6946641,2019-08-21 20:42:16,5,j***7
1,1,13313707718,6946605,1b917979-3e7c-4bac-8bb2-2ee74d96249b,现在买这款真是太划算了，外观漂亮，拍照效果好，运行速度快，华为大品牌值得信耐，太喜欢啦，京东自营到货快，质量有保障，昨晚下单上午就到了，迫不及待打开用起来，极光渐变色漂亮，屏幕大，分辨率高，功能齐全，总之各种好，忍不住秀一秀，哈哈哈,2019-10-10 21:00:05,7321794,2019-10-09 18:35:12,5,hushzhxbj
2,2,12276134054,6946605,9ad8cf68-f07a-43d5-a466-425086fee6dd,运行流畅，屏幕灵敏，机身较轻，手持手感较好，外观漂亮，刚开始总感觉画面状态有些怪异，后来发现开了鲜艳模式，切换到正常模式舒服多了，喜欢什么样的这个因人而异，总体感觉很好。,2018-12-18 17:44:19,6946605,2018-12-15 14:22:58,5,j***l
3,3,12348040539,6946605,aaa713df-7864-4b4e-81e1-d53769ae6f02,外观不错，手感很好，音质也可以，主要是玩游戏吃鸡，杠杠的，可以一吃四，本身来有带保护膜和外壳，无须买膜，这个挺好的，效率不错，送货速度很快,2019-01-07 19:02:41,7321794,2019-01-05 20:45:36,5,环***玺
4,4,12186238815,6946605,7d350823-adb9-4496-87bc-ae7445404201,运行速度没问题，一点卡顿都没有，新机就是好用。每天一充，主要是上班不能玩，哈哈，所以下班回来都有50的电那样，晚上充满一次就行。主要是相机，后置相机拍得感觉没有mate10的后置拍出来的美，不过前置很给力，不愧是2400万像素的，拍出来的光线效果都很棒。,2018-11-25 20:53:19,7321794,2018-11-18 10:26:45,5,小***子
5,5,12709748553,6946605,a637df67-b29d-49b9-b01d-78ae12472137,亮黑色好看，物流快是肯定的了，然后开机快，颜色绚丽丰富，运行内存高，所以打游戏不会卡顿，看视频也很清晰，体验感好，通话清晰流畅，可以放两张卡，一个主要用来通话一个主要用来上网，摄像头不错，拍照清晰，颜色也更接近真实，色差小,2019-04-30 12:23:31,6946605,2019-04-25 09:46:41,5,A***雨
6,6,13223695490,6946605,83787d37-672e-4867-921d-4cad559e0d46,漂亮的外观，经典的颜色，实惠的价格，赶上秒杀2599入手，耳机，电源线，手机外壳，全是配套的。使用起来也很方便。头天晚上下单，第二天上午就收到了货。,2019-09-14 16:09:41,6946637,2019-09-12 21:59:37,5,jd_134397exx
7,7,12927116989,6946605,5bf14b5c-2e03-4894-942e-3b8a959ffc8f,总体来说还不错吧，卖家发货速度还蛮快的，快递还蛮给力的，18号早上的订单，20号早上收到货了，因为适逢618，能两天到差不多吧！手机自带透明膜，但是透明膜很容易留下指纹，还是得换成钢化膜才行。  送了一个透明的手机保护套，手机软件运行速度还蛮快的，夜景拍照模式很美，这个很赞哦！音色也挺不错的，用于办公和生活用的话，基本能满足！爸爸还蛮喜欢的！,2019-06-21 21:17:57,6946637,2019-06-18 10:11:44,5,铃***8
8,8,12553024191,6946605,463c30d8-e6e1-4544-b9bd-8aa65f0d3d15,"爱京东本地仓：晚上10点下单，第二天11点送到，对于新疆的用户想要的速度，只有京东能做到。华为的老用户，面前用的P8,,内存不足，许多APP用不了。三八送给自己的礼物：p20,容量超大，新增了许多功能：指纹、分屏、翻转静音、NFC、多账户.....实用、高效、安全。屏幕大小正好、轻、薄，手感好。科技改变生活。用了10天，很满意。",2019-03-17 20:43:10,6946641,2019-03-08 21:34:28,5,t***3
9,9,12478053224,6946605,64b9a039-4566-457b-89f1-8ca422984d40,帮别人买的，说挺好用的，手感好，外形也好看，主要是用起来很舒服，用户体验好。莱卡效果拍照，不是盖的。背面是渐变色蓝色，有质感。各种软件下载起来，也很流畅，还送了手机壳。,2019-02-22 18:27:47,8758880,2019-02-20 18:53:40,5,s***y
10,0,12714833634,6946605,25e8124d-a359-4496-a6e5-8709ae594013,"用了将近两个月才评价:
1.外观设计时尚，小刘海又很讨人喜欢。背面双摄和竖排HUAWEI字样也很时尚新颖突出，这尺寸5.8确实是比例好，手感也很好，放口袋也适合。
2.运行流畅，毕竟是麒麟970，游戏偶尔小卡顿，正常还是流畅。
3.拍摄及音乐，P20拍摄成像自然清晰，确实功能强大，音乐音质也是比较棒。
4.运行内存6+128目前已经是足够用，基本能满足大部分人群。
5.总体评分:96分，如果是8+128G那就相当OK。",2019-05-01 21:10:45,8969571,2019-03-05 10:18:52,5,CYR923
11,1,13245689052,6946605,3dc0eab6-5ed3-46d7-ad24-bbf286ea9f92,做工精细，初始化简单，操作简便，反应迅速，特别是拍照效果还不错，还有很多功能慢慢研究。手机壳很薄非常合适，需要再配一个钢化膜。,2019-09-20 18:04:16,6946637,2019-09-18 20:11:38,5,杂货铺-z
12,2,13257180397,6946605,347be297-7cbf-4253-a409-91479611e27b,好漂亮呀，手机不是很大，但是是全屏的，使用面积很大，反应也快，嗖嗖的，颜色显示漂亮，自带美颜相机，常用的功能用下来都满意，今天给它贴了个膜，配了个壳，完美,2019-09-23 21:48:25,7321794,2019-09-20 20:59:57,5,伊***1
13,3,12556474605,6946605,e83bb3be-29ab-4858-ac74-34dd3226e0e5,"速度可以
屏幕漂亮
主要是拍照 确实很好，上一个是么一6，拍照那个垃圾，比荣耀6还比不上，差这么多年的新高，这个、20更是比么一什么的强，这几年看，还是不要选么一森么的了",2019-03-18 21:04:58,7321794,2019-02-12 23:03:14,5,土***卜
14,4,12280757772,6946605,76f1bed7-325f-41f1-8178-f00bbc7905a6,手机用了几天才来评价的，手机很漂亮，刚开始打算买金色，后来买的极光色，京东服务送货上门，手机内存也够了，平常也就是上网聊天，听听音乐，很少玩游戏的。视频聊天自带美白效果，声音挺大的，人性化多一些。整体来说机子不错，这个尺寸适合女生，不大不小。京东六期做的分期，没有利息真好！,2018-12-19 20:15:15,6946641,2018-12-11 13:45:30,5,其***u
15,5,11921583159,6946605,1f3aaca8-916f-4864-a392-76ef9dcb85ef,昨晚6点多才下单。今天早上8点半左右就送到手上。京东物流这速度真的非常好。其次就是这手机，给我的感觉也非常不错。首先在打开包装，把手机拿在手上，这个质感、大小、重量都挺不错的。就感觉是摸了一个缩小版苹果7P，这个尺寸真的是我非常喜欢的，个人不太喜欢太大尺寸（长宽高，并不是屏幕英寸）。另外它的耳机跟充电口跟7P是一样的，都是共用，所以这点用起来一点都没有难受感。另外我也没有特意撕掉新机附着上面的保护膜，触感也是很灵敏，而且还发现这台华为P20有很多系统功能，是7P没有的，拍照就不用说了，对比一下，确实感觉很专业。华为的系统真的是强大，不愧是开再苹果店旁边的华为，最关键的是这是我第一次用华为，在@新机这个过程中，体验度感受度都挺nice。下面就晒图说话,2018-09-18 09:51:30,6946641,2018-09-17 18:08:32,5,J***C
16,6,12495293801,6946605,3e997672-5e7a-46fd-b7c8-4a8887e7434c,手机表现不错，人脸识别速度很快，像素不错！反应也比较快，原厂还贴了膜，手机壳这些，细节决定成败，支持一下！,2019-02-28 10:33:20,6946637,2019-02-23 23:38:24,5,煌***好
17,7,12466939552,6946605,abfd33f0-d8f1-4085-afd0-284c8d851e77,P20手机不错，瘦长型，适合女性使用。手机运行流畅，显示色彩艳丽。特别是拍照功能，效果很好，细节清晰，色彩漂亮。不愧是突出拍照功能的手机。,2019-02-19 14:36:28,8758880,2019-02-14 15:52:37,5,网***游
18,8,12679673056,6946605,3ee92e0d-e663-4c25-b3dd-43ac453758d7,使用了几天 速度超快 比iPhone 8感受好 稍微不习惯返回机制 屏幕 待机 信号强度是甩iPhone几条街 双卡双待很给力,2019-04-22 17:43:46,7321794,2019-04-16 22:26:51,5,奇点8818
19,9,13228459478,6946605,20410a8c-fc60-49b0-96f0-bfb503ed7539,"手机还是一如既往的喜欢华为
P20大小合适，5.5寸不大也不小，正合适我
手机像素很好，拍照清晰
电池耐用，还是能够坚持很久
双卡双待，正好两张电话卡，嘻嘻
买了这个手机也不影响玩游戏啥的，而且这个手机颜色经典黑也是非常不错。哈哈哈  好评！",2019-09-15 21:39:12,6946637,2019-08-31 16:53:35,5,sdaffan破晓
20,0,12709724079,6946605,e9fbad6c-9f21-4b73-9a26-9d31931b8e3c,华为手机我喜欢，热门的手机啊，虽然有其他颜色，但是万年最爱还是黑色啊，经典颜色，手感好，顺滑，开机快速，全网通，还是双卡槽，一个放移动一个放联通，爽。运存也比之前的高，之前只有4G，现在换6G的，快好多，打游戏很顺畅不卡顿,2019-04-30 12:16:41,6946605,2019-04-25 10:17:42,5,A***雨
21,1,12435443345,6946605,ce361734-3e87-4f86-8040-caabcb95f6e4,开机反应快，大小合适，沉甸甸的。很有质感。国产手机还是华为的。比实体店便宜。软件运行速度快。满意。随机送了一个移动卡。还没有使用。不错。,2019-02-03 17:58:14,6946605,2019-02-01 21:45:22,5,j***8
22,2,12109894049,6946605,08b70f8c-f33f-4a77-b9f6-aa61088b4351,外观很好看，很喜欢，质感很好，但是感觉摄像不是特别好，没有三摄像的好，打开应用很快，不错不错。还有送耳机转接器，很有心。指纹解锁，面部识别，都很快。,2018-11-10 20:24:42,8969571,2018-11-09 20:27:20,5,d***C
23,3,12341596399,6946605,e9e7211c-1ae4-48bd-9aa0-9255bc885260,女朋友送的生日礼物，非常喜欢，自己舍不得买，亲爱的给买了，好感动[亲亲]！己经用了一段时间，拍照效果很棒，特别是夜景拍摄效果绾跻饬系暮谩７从λ俣群芸欤外观及亮丽的颜色也很美，大小正合适，拿在手上正好，充电超快，电池续航能力很强，基本上一天一充，网速也快，很好的手机，支持国货。,2019-01-05 22:10:54,8758880,2018-12-12 13:54:52,5,第***薇
24,4,12324829720,6946605,e9d1d903-af05-4315-980a-4bd4fd46f942,华为，国产良心货。屏幕清晰，分辨率高。系统流畅，6g内存，APP切换顺滑。指纹模组反应快，手势操作简单，准确。极光色，漂亮，大气。,2019-01-01 10:59:37,7321794,2018-12-14 23:03:04,5,c***g
25,5,12288549220,6946605,8de14313-03ae-4f2b-90dc-382179173ac9,华为的拍照确实不错，显示效果也可以，本人之前用的苹果7，感觉像素没得比，再加上新苹果太贵，还同等价位性能比不上华为，主要是加拿大居然敢找事，我砸了苹果再也不用了，支持一下国产，现在国产雄起了，系统流畅度不比苹果差了，我给我老爸买的华为荣耀8，老爸说挺好用的，以后等华为5g出来了我再换新华为P30，嘿嘿?,2018-12-21 21:01:42,8758880,2018-12-21 10:07:50,5,_***6
26,6,12487866283,6946605,f24e880d-3f0d-4a82-be58-a1e72888a6ac,给老公买的，包装很好，老公很喜欢，手感很好，颜色好看，屏幕看起来很舒服，运行速度给力，大大的赞，现在我们一家人都是用华为，永远支持华为,2019-02-25 21:35:03,8758880,2019-02-22 07:17:40,5,l***7
27,7,12335621738,6946605,5a016784-08a2-4a33-8559-87d3dfb18df0,超级快，昨天下的单，今天早上9点半就收到了，快递是飞来的，特别感谢了，公用手机还没有申请到号码，要等申请了号才可以使用，看着非常高大帅气，特别上档次，颜色也可以，想要的颜色没货，这个也可以，整体非常好?，比镜子还亮，颜色还会变，真不错，以后也要换华为手机。,2019-01-04 10:36:57,8969571,2019-01-03 16:35:07,5,小鲤鱼112tg
28,8,12835312467,6946605,6f412146-b385-402e-9b56-f22f51082127,手机外观真的是贼好看，特别喜欢极光色，质感和手感都可以，用起来也还不错，反正现在使用起来是不卡，第二部华为了，用的好之后还会买！,2019-06-02 18:19:52,7321794,2019-06-01 21:37:36,5,151*****495_p
29,9,11416177880,6946605,ab8f17cf-d8dd-4f94-9a46-b3b912de0609,"不想等荣耀10，就是喜欢p20。
渐变粉的玻璃壳撩炸了老夫的少女心！（玻璃壳异常容易粘指纹）
华为美术馆壁纸和交响乐章手机铃超贴合心意~
华为智能界面设计相对用过的其他手机，出乎意料的人性化！付款超快，快递自动显示，一键打车（不用去找软件啊）
日历支持中国农历及法定假日的调休显示（个人在意）
备忘录界面支持打印和水印，切换显示也很水心，今后改进加密和分类会更好。
拍照功能强大，美颜功能很霸道~AI功能鸡肋，只能说尚不成熟。照片与云端管理同步很人性。
自从有了通话volte，再也不担心突然来电造成断网了。
面部解锁新颖但不成熟没有苹果安全。
下部的返回键，因为之前用的魅族苹果，所以突然用华为这个真是很不习惯了，后续再看吧。
连续划屏确实不流畅，有待改进。
一打的预装软件自己卸掉。
刘海屏很伪（笑），但是很美！侧边框比X窄，看起来比X轻薄，不想说下巴（笑）
不用于游戏，不评价性能。
电量，算比较耐用了，中度使用一天一充。
总体评价：美！人性化！智能！
让人感觉到科技在进步，不悔入华为。
华为真的很棒了，今后也继续加油啊~",2018-04-21 10:23:02,6946635,2018-04-17 16:18:02,5,匀***舞
30,0,13311803726,6946605,21e75d0d-1b4a-455f-923c-e471476c2602,中华有为！专门用了两天才决定过来评价，首先拍照效果特别好，尤其是人像美颜这一块。充电速度方面也非常快，我就用的原装的充电器，差不多45分钟弄好。主要是华为现在的生态系统越来越完善了，手机和电脑无缝连接，感觉特别爽。慢慢的话可以追上苹果，所以买了这款，推荐大家购买,2019-10-10 12:12:59,7321794,2019-10-06 12:12:35,5,程浩啊啊啊
31,1,13228749292,6946605,ae044c76-412e-4ec3-8127-29d5242c2afa,外观漂亮，配置可以，手感很好！之前用苹果，还以为换国产不能习惯呢？玩了一会，很好用！比之前强多了。先用着看看，过一段时间在评论！,2019-09-15 23:09:11,6946605,2019-09-14 21:30:35,5,j***o
32,2,12441547520,6946605,d2d10672-e8d3-4ce4-8321-38534208e7ba,包装里包括了贴膜和简单的透明外壳，经济实用。手感很好，长宽比例优美。外壳玻璃材质，颜色比图片稍微深一些。使用反应流畅，和我之前用的P9比起来，多了很多实用功能，华为手机之间的克隆超级方便。,2019-02-09 13:55:04,6946641,2019-02-07 10:04:23,5,s***s
33,3,12556206162,6946605,38e22ee4-c96f-4a2d-8b1a-ffcfd3e92c21,机子外观精美，屏幕显示清晰，色彩鲜明，系统运行迅捷流畅，拍照效果很好，比之前使用的mate9提升明显，新机已贴好钢化膜，配送原厂透明硅胶手机壳，总之非常满意。,2019-03-18 19:45:30,6946605,2019-03-16 16:02:56,5,我***惜
34,4,12448444091,6946605,c7a15b40-bcf4-4766-9290-f3788836f258,用起来很流畅，电池也很耐用，玩一天不成问题。屏幕比较大，然后看起来也比较舒服。照相机的夜景模式特别好，拍出来的很好看。,2019-02-12 22:46:28,6946605,2018-12-23 21:33:33,5,A***y
35,5,12303965338,6946605,3014eeb7-28b6-4076-97be-5abbdccbbb37,一款很适合女生的手机，在这大屏时代里这算是小屏手机里的经典款了，颜色好看，外观大方，电池耐用，对于不打游戏的女生内存足够了。双十一买的，用到现在很顺手，没什么问题。,2018-12-26 09:03:05,8758870,2018-11-11 15:39:12,5,jd_超英速蜗牛
36,6,12454118120,6946605,f15fa9e2-9d52-4b60-9fa1-d9d72a88fc3f,总体很满意呀，机子很漂亮，运行也很快，一如既往支持华为。唯一不满意是系统占用固定内存和运行内存太多，好好的6g，留给应用的只有3g多一点。现在的app都是内存老虎，越更新占用空间越大，加上预置应用和系统，64g估计很快就不够用。就不能省点心？,2019-02-15 10:14:07,8758880,2019-01-29 21:28:01,5,2***m
37,7,13227904077,6946605,ac65cd76-0d9f-42dc-85db-0266ebcdf561,第一次买华为手机，因为周围的朋友用华为的不少，支持一下国产品牌和华为。买来给老人家使用，使用的APP不多，能够完全满足要求。色彩很好，屏幕够大，老人满意。京东送货也飞速，下单第二天11点就拿到手了。,2019-09-15 19:04:25,7321794,2019-09-13 13:12:00,5,樱桃真可爱
38,8,12136780780,6946605,92ef63ce-7b5d-4314-a1da-ffe25331d3ae,"手机用了段时间到现在才能评价。
这手机绝对没得说，质量好，各方面都不错。
手机反应很快，像素很清晰，不愧是徕卡摄像头。
充电也很快，非常快，待机时间也长。",2018-11-15 09:25:28,7321794,2018-11-01 20:24:02,5,T***t
39,9,12710545060,6946605,347af9e0-80cd-4234-a889-5ace7b545892,样式很喜欢，拿在手里大小太合适了，随机送的手机壳可方便了，新机各方面都没话说，操作起来简单，通话流畅，电池续航强，支持华为,2019-04-30 16:05:21,6946605,2019-04-13 16:28:23,5,d***-
40,0,12418105674,6946605,88a26597-bc01-4316-9d66-265e382adb6b,我这是第二次购买华为p20了，真心感觉这款手机非常的好用，就是因为之前用过所以更加信任，华为做手机非常的专业了，支持国产，绝对支持，对于这款手机不管从大小、屏幕、系统、流畅度和显示上在同等价位上对比是十分出众，性价比非常高，推荐购买。,2019-01-27 22:47:22,6946605,2019-01-17 00:29:16,5,z***4
41,1,12377348131,6946605,ed24c4b6-7437-444b-ae30-2c0f0759cff3,音质清晰，像素给力，充电很快，手感丝滑，机身结构按键布局合理，细节功能多，比苹果用起来舒服，但愿能坚持长久不出毛病，支持国产，支持华为！,2019-01-16 09:22:38,6946605,2019-01-10 20:07:58,5,jd_159420xzs
42,2,12333022833,6946605,0a25d03f-bcc9-49ce-81e2-d87c9f3118a4,告别了苹果，选了华为的这一款，之前没有用过华为，这款小一些，带孩子方便拿一点，用了一天，感觉不输苹果，电池也耐用，手机操作也方便，反应也很快，还有短信那里把乱七八糟的短信都放一个文件夹里了，再也不用打开就很多短信啦，这个颜色也很漂亮，手机出厂贴了膜，还送了壳，不错的手机，支持华为，以后就用华为的手机啦。,2019-01-03 15:13:26,8969543,2019-01-01 20:00:20,5,三***鱼
43,3,12905370106,6946605,4676a4d9-da20-45d3-bd2e-358623e0d6a4,我女儿给我选的，货一到就迫切的打开看了，嗯嗯，很喜欢，手感很好，而且京东上买东西，效率很快，好满意。,2019-06-18 11:16:30,7321794,2019-05-31 23:53:43,5,j***1
44,4,12367827879,6946605,45750bb1-e701-42af-b51f-d3f047048d30,用了一段儿时间，反应快，音质清，本来要买m20，结果上市一看太大了，就改了P20，大小合乎自已要求，满意！快递很快，服务也很好！,2019-01-13 14:39:58,6946605,2018-11-29 20:02:15,5,z***步
45,5,12906619139,6946605,ae13baeb-8795-4fc0-a601-b6288fb3a963,外观精美，手感很好。屏幕够大，像素也高，操作起来很快。支持华为，支持国货！,2019-06-18 14:42:25,6946641,2019-04-22 15:53:38,5,d***a
46,6,12497724970,6946605,d154e47c-5dea-4bab-a3b2-7cb3b2af8925,挺漂亮的，非常清晰，对刚入行的年轻人来说非常棒。实际使用起来，指纹解锁也够用了的。这个屏幕爱不释手，要是买得起MATE 20X就更好了。,2019-02-28 23:21:44,7321794,2019-02-08 22:31:39,5,萌***酱
47,7,12291296100,6946605,d94931f0-a9b9-48ba-b0bb-38e92cbd4e0a,屏幕尺寸适合。电池续航非常好，充满电之后一天都用不完啊。各种性能也很好。而且取消了耳机孔，和充电线是同一个接口，感觉很新鲜！！,2018-12-22 17:30:26,6946641,2018-12-12 20:50:58,5,x***-
48,8,11856850990,6946605,61ffa8a4-f446-4923-b039-ab020207fffd,极光色，颜值真心高！图一裸机，美的高调、不像实力派；图二带了保护套，依然漂亮，只不过低调了好多；图三手机自拍，无美颜，就是这么牛?！赞赞赞赞赞赞赞赞赞！希望手机电池用的时间长一些吧！之前买了荣耀8，用了一年半，完全不卡顿，但是电池已经不行了。,2018-08-30 08:35:36,7321794,2018-08-28 11:14:36,5,Y强强in
49,9,13268591450,6946605,d92954ba-ed00-4047-adab-be7baff0cc59,买来老公用的，京东送货很快，不耽误使用。手机一直用到现在了，没有什么问题，这款也好看，黑色大气，天天用来玩游戏，屏幕也很清晰，反应灵敏，玩的很爽呀，哈哈。支持国产手机，就期待使用寿命了，用得住的话后面还会购买，加油加油。,2019-09-27 06:49:52,6946637,2019-08-25 16:57:19,5,青色小瓶盖
50,0,12351309237,6946605,79a355c9-88ac-4ad9-aed4-ce894071466a,支持华为，用着很顺利，速度快，屏幕灵敏，自动带很多有用的应用软件。摄像功能是强项吧，感觉还没发挥出最佳效果。电池耐用，很喜欢。,2019-01-08 17:47:32,8758880,2018-12-12 21:29:02,5,x***u
51,1,12420754031,6946605,aabe8f51-eca6-4712-9db3-219e6ead3057,这手机。不得不说很好。对我来说，非常满意。没有什么太大问题。各方面都还行。现在还没有咋用。用一段时间看看。第一次购物。很满意。好评,2019-01-28 19:37:04,7321794,2019-01-28 04:55:48,5,j***y
52,2,11845972118,6946605,19057edb-0ece-4007-85b2-173fa25f9de7,很好，快递很快，大早上就送过来了，打开很惊喜，黑色的很漂亮，用起来也很快，电池感觉不是那么抗用，刚开机49的电，没怎么用，放那一个多小时就没了，不知道是虚电还是什么,2018-08-26 21:26:07,6946605,2018-08-25 20:25:03,5,唏***啊
53,3,12488394525,6946605,63e06333-e92c-4c2f-9952-61f08c1b1d9a,手机已收到，华为国产支持一下，手机非常惊艳，特别好看，简单试用了下，反应挺快的，照相清晰，通话没听出哪里不对，语音清晰，游戏吃鸡不卡顿，其它使用过后再分享,2019-02-26 07:31:47,8969571,2019-02-24 12:12:05,5,一***你
54,4,12233446590,6946605,310b5f28-e639-49ba-9c79-5ae3ceb2c1ae,用了将近一个月了，再来评价的。1.外观：设计很时尚，漂亮。四边双面圆弧，很流畅圆润。小刘海又很讨喜。背面双摄及&ldquo;HUAWEI&rdquo;等字样竖形排列，很时尚新颖，超喜欢。前置指纹解锁速度快（比起mate20，我更喜欢P20的外观。）。2.运行：我偶尔玩下游戏，基本上还是很流畅。其他正常使用中，小小卡顿会有，但极少发生（毕竟是10**工艺的麒麟970，这运行速度我觉得很好了。咱不和7**工艺的980比哈哈）。3.拍照音乐：说实话，买P20很大一点就是看中它的拍照成像自然清晰。音乐方面音质也是比较棒。4.运存内存：6+128，我认为基本上都能满足一般人的使用需求。5.总体体验：95分吧！唯一一点，要是运存改成8，就完美了哈哈???。期待P系再出佳品！！！,2018-12-08 14:11:02,8969571,2018-11-11 00:06:09,5,无***1
55,5,11970613721,6946605,aa120ee2-3984-480e-bd8b-df95ca13575b,p20真的很优秀！系统反应很流畅，人脸识别和指纹识别速度非常快！选了很久，决定这款机型，真的没有选错！颜色很漂亮，男女都适合！这个屏幕大小刚好，拿在手里很舒服，不会太宽，手感也很好，就是容易吃指纹。原厂还配送了透明壳，还有高清膜已贴好，真的很贴心！,2018-10-03 14:13:10,8758880,2018-10-01 00:19:27,5,y***9
56,6,12724340309,6946605,d6ae23c6-a196-4f58-8274-dbec3bbe9277,P20的握持感和观感都符合一个旗舰手机的定位，有一种金属质感和高级感。相机没让人失望，AI智能场景识别很方便，夜拍也不错。手机克隆功能非常好，上一个手机的相关资料全部快速复制过来。与上一个品牌vivo的手机相比，系统各有特色，各有优劣，但是我还是喜欢vivo的系统。中度使用用户，电池一天一充，不是很耐用。是一部值得推荐的手机。,2019-05-04 16:40:29,8758880,2019-04-23 13:02:43,5,a***1
